type,topic,source,title,body,tag,payload
quiz,Interview Prep,llm,"Quiz: Counting islands","In number of islands, what guarantees each island is counted exactly once?","Graphs","{""options"": [""Sorting the grid first"", ""Flood-filling the entire island when first touched"", ""Checking all 8 neighbors"", ""Counting land cells and dividing""], ""correct"": ""Flood-filling the entire island when first touched"", ""explain"": ""The fill marks every cell of the island visited, so later scan positions inside it are skipped. Count increments only on first contact with each component.""}"
fact,Interview Prep,llm,"Connected components","Count components in an undirected graph: loop every node, and each time you find an unvisited one, increment the count and traverse its entire component. Same skeleton as islands — the grid version and graph version are one pattern.","Graphs",
fact,Interview Prep,llm,"Labeling components","Assign each node a component id during traversal and same-component queries become O(1) lookups afterward. This precompute-then-query structure answers can u reach v many times without re-traversing.","Graphs",
fact,Interview Prep,llm,"Union-Find does it too","Union-Find counts components without traversal: start with n components, union each edge, decrement when two roots merge. It is the better fit when edges arrive over time — dynamic connectivity — while DFS suits a static snapshot.","Graphs",
quiz,Interview Prep,llm,"Quiz: Component counting","Edges arrive one at a time and after each you must report the number of connected components. Best tool?","Graphs","{""options"": [""Rerun DFS each time"", ""Union-Find"", ""Topological sort"", ""Dijkstra""], ""correct"": ""Union-Find"", ""explain"": ""Union-Find handles incremental edge additions in near-O(1) amortized per union, decrementing a component counter on merges. Re-running DFS per edge would be O(E times (V+E)).""}"
fact,Interview Prep,llm,"Cycles in undirected graphs","DFS an undirected graph tracking each node's parent: meeting a visited neighbor that is NOT your parent means a cycle. The parent exception matters — the edge you just walked in on is not a cycle. Union-Find alternative: an edge whose endpoints already share a root closes a cycle.","Graphs",
fact,Interview Prep,llm,"Cycles in directed graphs","Directed cycles need three colors: white unvisited, gray in the current recursion stack, black finished. Reaching a GRAY node means a back edge — a cycle. Reaching a black node is fine: that is a completed branch, not a loop.","Graphs",
fact,Interview Prep,llm,"Why the difference","In directed graphs the parent trick fails because a two-node cycle u to v to u is legal and real. The gray state encodes am I currently on the path from the root — exactly what a directed back edge violates. Explaining WHY earns more than reciting the method.","Graphs",
quiz,Interview Prep,llm,"Quiz: Gray means cycle","During directed-graph DFS with white, gray, and black states, hitting which state signals a cycle?","Graphs","{""options"": [""White"", ""Gray"", ""Black"", ""Any visited state""], ""correct"": ""Gray"", ""explain"": ""Gray nodes are on the current recursion path, so an edge into one loops back onto your own path — a back edge. Black nodes are finished and safe to re-reach.""}"
fact,Interview Prep,llm,"Kahn's algorithm","Topological sort by BFS: compute every node's in-degree, enqueue all zero-in-degree nodes, and repeatedly pop one into the order while decrementing its neighbors' in-degrees — enqueueing any that hit zero. Fewer nodes output than exist means a cycle.","Graphs",
fact,Interview Prep,llm,"DFS topological sort","The DFS version: run DFS and push each node onto a stack as it FINISHES; popping the stack yields a topological order. It works because a node finishes only after everything it points to — its finish time proves its prerequisites-completed status.","Graphs",
fact,Interview Prep,llm,"Course schedule family","Course schedule I asks can you finish — cycle detection. Course schedule II asks for an order — the topological sort itself. Alien dictionary derives edge constraints from word comparisons first, then toposorts. Prerequisite language in a problem means build a DAG.","Graphs",
quiz,Interview Prep,llm,"Quiz: Kahn's cycle check","Running Kahn's algorithm, the output order contains fewer nodes than the graph. What does that prove?","Graphs","{""options"": [""The graph is disconnected"", ""The graph contains a cycle"", ""The graph is undirected"", ""Nothing — rerun it""], ""correct"": ""The graph contains a cycle"", ""explain"": ""Nodes in a cycle never reach in-degree zero — each waits on another — so they never enqueue. A complete output is exactly the certificate that the graph is a DAG.""}"
fact,Interview Prep,llm,"Union-Find in four lines","Union-Find tracks disjoint sets with a parent array. Find follows parents to the root; union links one root under the other. It answers are these two connected in effectively constant time — the dynamic connectivity workhorse.","Graphs",
fact,Interview Prep,llm,"The two optimizations","Path compression points every node on a find path directly at the root; union by rank or size hangs the shorter tree under the taller. Together they make operations amortized inverse-Ackermann — say effectively O(1) and note the function grows slower than log.","Graphs",
fact,Interview Prep,llm,"Union-Find applications","Redundant connection (the edge that closes a cycle), accounts merge, number of provinces, and Kruskal's MST all reduce to union and find. Grid variants map cell (r, c) to id r times cols plus c. If a problem merges groups incrementally, this is the tool.","Graphs",
quiz,Interview Prep,llm,"Quiz: Path compression","What does path compression do during a find operation?","Graphs","{""options"": [""Deletes redundant edges"", ""Points every traversed node directly at the root"", ""Sorts the parent array"", ""Merges two sets""], ""correct"": ""Points every traversed node directly at the root"", ""explain"": ""Flattening the chain makes future finds on those nodes one hop. Combined with union by rank, operations become amortized near-constant.""}"
fact,Interview Prep,llm,"Dijkstra's loop","Dijkstra with a min-heap: pop the unsettled node with smallest tentative distance, settle it, and relax its edges — push (newDist, neighbor) whenever a shorter path is found. With lazy deletion of stale entries it runs in O(E log V).","Graphs",
fact,Interview Prep,llm,"Why no negative edges","Dijkstra's correctness rests on a settled node never improving — true only when all edges are non-negative, so any detour costs extra. A negative edge could undercut a settled distance later. Bellman-Ford tolerates negatives at O(V times E) by relaxing all edges V minus 1 rounds.","Graphs",
fact,Interview Prep,llm,"0-1 BFS","When every edge weighs zero or one, a deque replaces the heap: push zero-weight discoveries to the FRONT and one-weight to the back. Distances stay sorted in the deque and the run is O(V + E). Awareness level — name it if weights are binary.","Graphs",
quiz,Interview Prep,llm,"Quiz: Dijkstra's prerequisite","Which condition must edge weights satisfy for Dijkstra's algorithm to be correct?","Graphs","{""options"": [""All weights equal"", ""Non-negative weights"", ""Integer weights"", ""Weights below V""], ""correct"": ""Non-negative weights"", ""explain"": ""The greedy settle step assumes no future path can undercut a settled node, which negative edges violate. With negatives, use Bellman-Ford.""}"
fact,Interview Prep,llm,"Minimum spanning trees","An MST connects all nodes with minimum total edge weight and no cycles. Prim's grows one tree greedily with a heap of frontier edges; Kruskal's sorts all edges and adds any that join two different Union-Find components. Awareness level: know both names and mechanics.","Graphs",
fact,Interview Prep,llm,"Kruskal plus Union-Find","Kruskal is the cleaner interview implementation: sort edges ascending, iterate, union endpoints, keep edges whose endpoints were in different sets. O(E log E). Min cost to connect all points is this exact algorithm on implicit distance edges.","Graphs",
fact,Interview Prep,llm,"MST vs shortest path","An MST minimizes TOTAL connection weight; shortest-path trees minimize distance from a source. They differ — an MST path between two nodes can be longer than their shortest path. Confusing them is a known trap question.","Graphs",
quiz,Interview Prep,llm,"Quiz: Kruskal's guard","In Kruskal's algorithm, when is a candidate edge rejected?","Graphs","{""options"": [""When it is the heaviest edge"", ""When its endpoints already share a component"", ""When it touches a leaf"", ""When the heap is empty""], ""correct"": ""When its endpoints already share a component"", ""explain"": ""Connecting two nodes already in the same Union-Find set would close a cycle. Accepting only cross-component edges keeps the growing forest a tree.""}"
fact,Interview Prep,llm,"Bipartite checking","A graph is bipartite when nodes split into two groups with every edge crossing between them. Test by 2-coloring: BFS or DFS, alternating colors along edges; any edge joining two same-colored nodes kills bipartiteness. Run from every component.","Graphs",
fact,Interview Prep,llm,"Odd cycles are the obstruction","A graph is bipartite exactly when it has no odd-length cycle — alternating two colors around an odd loop must collide. That theorem is the one-line justification for why 2-coloring works.","Graphs",
fact,Interview Prep,llm,"Bipartite in disguise","Is graph bipartite is the literal version; possible bipartition of people who dislike each other is the same 2-coloring with edges meaning must differ. Any can these be split into two conflict-free groups question should trigger the pattern.","Graphs",
quiz,Interview Prep,llm,"Quiz: Bipartite failure","During 2-coloring BFS, what observation proves a graph is NOT bipartite?","Graphs","{""options"": [""A node with odd degree"", ""An edge between two same-colored nodes"", ""A disconnected component"", ""A node with no edges""], ""correct"": ""An edge between two same-colored nodes"", ""explain"": ""Bipartite means every edge crosses the partition. A monochromatic edge means the alternating assignment failed — equivalently, an odd cycle exists.""}"
fact,Interview Prep,llm,"Bridges and articulation points","A bridge is an edge whose removal disconnects the graph; an articulation point is such a node. Tarjan's DFS finds them by comparing discovery times with low-link values — the earliest node reachable through the subtree. Awareness level for Google.","Graphs",
fact,Interview Prep,llm,"The low-link intuition","A child subtree that cannot reach back above its parent — its low-link is not smaller than the parent's discovery time — depends entirely on that connection: cutting it isolates the subtree. That one sentence is the entire intuition to retain.","Graphs",
fact,Interview Prep,llm,"Where it shows up","Critical connections in a network — find the cables whose failure splits the network — is the bridges problem verbatim, and a real Google-style question. Recognize it, name Tarjan, state O(V + E), and sketch the low-link idea.","Graphs",
quiz,Interview Prep,llm,"Quiz: Bridge definition","What makes an edge a bridge in a connected undirected graph?","Graphs","{""options"": [""It carries maximum weight"", ""Removing it disconnects the graph"", ""It belongs to a cycle"", ""It touches the root""], ""correct"": ""Removing it disconnects the graph"", ""explain"": ""A bridge is the only path between its two sides — no cycle offers an alternate route. Edges inside cycles are never bridges.""}"
fact,Interview Prep,llm,"Cloning a graph","Clone graph: traverse from the given node with a hash map from original to copy. On visiting a node, create its clone if absent, then wire clone neighbor lists recursively. The map is simultaneously the visited set and the wiring table.","Graphs",
fact,Interview Prep,llm,"Why the map prevents infinite loops","Graphs have cycles, so cloning without checking the map would recurse forever. Check the map FIRST — if a clone exists, return it immediately. This is copy list with random pointer generalized from a line to an arbitrary shape.","Graphs",
fact,Interview Prep,llm,"Serializing graphs","Graphs serialize as edge lists or adjacency maps with explicit node ids — unlike trees, structure alone does not identify nodes, and cycles forbid naive recursive output. If asked, propose the id-plus-edge-list format and note that assumption.","Graphs",
quiz,Interview Prep,llm,"Quiz: Clone graph's map","In clone graph, the original-to-copy hash map serves which two roles at once?","Graphs","{""options"": [""Sorting and searching"", ""Visited tracking and clone lookup"", ""Weighting and pruning"", ""Coloring and counting""], ""correct"": ""Visited tracking and clone lookup"", ""explain"": ""A key's presence means the node was already cloned (visited), and the value hands you the copy to wire into neighbor lists — one structure, both jobs.""}"
fact,Interview Prep,llm,"A* in one sentence","A* is Dijkstra plus a heuristic: the priority becomes distance so far PLUS an estimate to the goal, steering the search toward the target instead of expanding in all directions. Awareness level — no one codes it in 45 minutes.","Graphs",
fact,Interview Prep,llm,"Admissible heuristics","A* stays optimal when its heuristic never OVERESTIMATES the true remaining cost — called admissible. Grid pathfinding uses Manhattan distance for 4-directional movement. Overestimate and A* can return a wrong, non-shortest path.","Graphs",
fact,Interview Prep,llm,"When to mention A*","If an interviewer extends a grid shortest-path solution with the goal position is known — can you search smarter, the expected answer is A* with Manhattan distance. One sentence of what and why suffices; then relate it back to your Dijkstra code.","Graphs",
quiz,Interview Prep,llm,"Quiz: A* priority","What quantity does A* use to order its priority queue?","Graphs","{""options"": [""Distance from the start only"", ""Estimated distance to the goal only"", ""Distance so far plus a heuristic estimate to the goal"", ""Node degree""], ""correct"": ""Distance so far plus a heuristic estimate to the goal"", ""explain"": ""The g plus h score biases expansion toward the goal while still accounting for the path already paid — Dijkstra is the special case where h is zero.""}"
fact,Interview Prep,llm,"LRU as a design question","Design an LRU cache is a Google staple: O(1) get and put via a hash map into a doubly linked list ordered by recency — evict from the tail at capacity. Practice writing it end to end in under 15 minutes, with dummy head and tail sentinels.","Advanced Structures",
fact,Interview Prep,llm,"The API contract","Nail the semantics before coding: get returns the value and refreshes recency; put inserts or updates, also refreshing recency, then evicts the least recent if over capacity. Half of failed LRU attempts forget that get itself counts as a use.","Advanced Structures",
fact,Interview Prep,llm,"Language shortcuts and honesty","Java's LinkedHashMap and Python's OrderedDict implement LRU almost for free — and interviewers know. The safe move: mention the shortcut exists, then offer to build it from primitives. The question is testing the internals, so expect to write them.","Advanced Structures",
quiz,Interview Prep,llm,"Quiz: LRU eviction","An LRU cache at capacity receives a put for a new key. Which entry is evicted?","Advanced Structures","{""options"": [""The newest entry"", ""The least recently used entry"", ""A random entry"", ""The largest value""], ""correct"": ""The least recently used entry"", ""explain"": ""LRU bets that recently touched data will be touched again. The doubly linked list's tail node is by construction the least recently used — remove it and its map key.""}"
fact,Interview Prep,llm,"LFU in one breath","LFU evicts the LEAST FREQUENTLY used key, breaking ties by recency. The O(1) design keeps buckets of keys per frequency count — each bucket an ordered list — plus a pointer to the minimum frequency. Awareness level: know the idea, not every edge case.","Advanced Structures",
fact,Interview Prep,llm,"LFU vs LRU behavior","LRU forgets popularity instantly — one burst of new keys evicts an old favorite. LFU protects frequently used keys but is slow to evict formerly-hot items. Naming that behavioral trade-off matters more in interviews than LFU implementation detail.","Advanced Structures",
fact,Interview Prep,llm,"The min-frequency pointer","The subtle part of O(1) LFU: track the current minimum frequency. It only ever resets to one on a brand-new insert, or increments when the last key at that level moves up — it never needs a search. That observation is the entire trick.","Advanced Structures",
quiz,Interview Prep,llm,"Quiz: LFU tiebreak","Two keys tie at the lowest use frequency in an LFU cache. Which is evicted?","Advanced Structures","{""options"": [""The least recently used of the two"", ""The most recently used"", ""The one with the larger value"", ""Both""], ""correct"": ""The least recently used of the two"", ""explain"": ""Standard LFU breaks frequency ties by recency — each frequency bucket keeps insertion order so its oldest entry evicts first. LFU degrades to LRU within a bucket.""}"
fact,Interview Prep,llm,"Bloom filters","A Bloom filter answers set membership in tiny space: k hash functions set k bits per inserted item; a query checks those bits. It can say definitely not present or probably present — false positives possible, false negatives impossible.","Advanced Structures",
fact,Interview Prep,llm,"Why the asymmetry","A zero bit proves the item was never inserted — insertion would have set it. All-ones can be coincidence from other items' bits, hence false positives. Deletions are unsupported for the same reason: clearing a bit could erase evidence of other items.","Advanced Structures",
fact,Interview Prep,llm,"Where Bloom filters live","Real systems use them as cheap gatekeepers: has this URL been crawled, is this key possibly in this database file (LSM trees), is this password in a breach list. In system design answers, a Bloom filter before an expensive lookup is a strong flourish.","Advanced Structures",
quiz,Interview Prep,llm,"Quiz: Bloom filter guarantees","Which error can a Bloom filter make?","Advanced Structures","{""options"": [""False negatives only"", ""False positives only"", ""Both"", ""Neither""], ""correct"": ""False positives only"", ""explain"": ""Other items' hashes can coincidentally set all of a query's bits — a false positive. But an inserted item's bits are never cleared, so a negative answer is always certain.""}"
fact,Interview Prep,llm,"Skip lists","A skip list is a sorted linked list with probabilistic express lanes: each node is promoted to higher levels by coin flips, letting searches skip long stretches. Expected O(log n) search, insert, and delete — a randomized alternative to balanced trees.","Advanced Structures",
fact,Interview Prep,llm,"Why they exist","Skip lists match red-black tree performance with far simpler code — no rotations — and lock more gracefully under concurrency. Redis sorted sets famously use one. The concept-level takeaway: probabilistic layering can substitute for careful balancing.","Advanced Structures",
fact,Interview Prep,llm,"Search path intuition","Searching starts at the top-left, moving right until the next node overshoots, then dropping a level — like an express train downgrading to local as it nears the stop. Halving expectations per level yields the O(log n) bound.","Advanced Structures",
quiz,Interview Prep,llm,"Quiz: Skip list levels","What determines how many levels a skip list node occupies?","Advanced Structures","{""options"": [""Its key value"", ""Random coin flips at insertion"", ""Its insertion order"", ""The list's current height""], ""correct"": ""Random coin flips at insertion"", ""explain"": ""Each node promotes to the next level with probability one half, repeatedly. The randomness maintains balanced express lanes in expectation with zero rebalancing logic.""}"
fact,Interview Prep,llm,"Interval trees and friends","An interval tree stores intervals for O(log n plus k) queries like which intervals overlap this point. Awareness level: know it exists so my calendar could use an interval tree lands correctly in design discussions — coding it is out of scope.","Advanced Structures",
fact,Interview Prep,llm,"Sweep line as the substitute","Most interview interval problems skip fancy trees: convert intervals to plus-one start and minus-one end EVENTS, sort them, and sweep while tracking a running count. Max concurrent meetings is the running count's peak.","Advanced Structures",
fact,Interview Prep,llm,"Calendar booking ladder","My Calendar I books if no overlap — a sorted map of start times works. Calendar II allows double but not triple booking. Calendar III asks the max overlap — the sweep count in a sorted map of deltas. The ladder is a favorite escalation sequence.","Advanced Structures",
quiz,Interview Prep,llm,"Quiz: Max concurrent intervals","Using the sweep line technique, how do you compute the maximum number of overlapping intervals?","Advanced Structures","{""options"": [""Sort by end time and count"", ""Track a running sum over sorted plus-one and minus-one events, taking its peak"", ""Merge all intervals first"", ""Binary search each interval""], ""correct"": ""Track a running sum over sorted plus-one and minus-one events, taking its peak"", ""explain"": ""Each start adds one active interval and each end removes one; sorting the events and scanning makes the running sum the live overlap count, and its maximum is the answer.""}"
fact,Interview Prep,llm,"O(1) insert, delete, getRandom","RandomizedSet pairs a dynamic array with a hash map of value to index. Insert appends and records the index; getRandom picks a random array slot; delete swaps the target with the LAST element, updates the swapped element's map entry, and pops.","Advanced Structures",
fact,Interview Prep,llm,"The swap-with-last trick","Arrays delete from the middle in O(n) but from the END in O(1). Swapping the victim to the back converts any deletion into a tail pop — order is sacrificed, which this structure never promised. That reframe is the entire question.","Advanced Structures",
fact,Interview Prep,llm,"Why both structures","The map alone cannot do getRandom — no O(1) way to pick a uniformly random key. The array alone cannot do O(1) delete by value — no way to find it. Each covers the other's weakness; explaining that pairing logic IS the interview answer.","Advanced Structures",
quiz,Interview Prep,llm,"Quiz: O(1) delete from array","How does RandomizedSet delete an arbitrary value from its array in O(1)?","Advanced Structures","{""options"": [""Shifts all later elements left"", ""Swaps it with the last element and pops"", ""Marks it as a tombstone"", ""Rebuilds the array""], ""correct"": ""Swaps it with the last element and pops"", ""explain"": ""The hash map locates the value's index instantly; swapping with the tail makes removal a pop. Just remember to update the moved element's index in the map.""}"
fact,Interview Prep,llm,"Design-a-structure questions","Design a hit counter, a time-based key-value store, a snapshot array: these test composing primitives — maps, lists, heaps, binary search — under stated complexity targets. Start from the required operations and their target costs, then pick parts.","Advanced Structures",
fact,Interview Prep,llm,"Time-based key-value store","TimeMap stores per key a list of (timestamp, value) pairs appended in increasing time order — so get(key, t) is a binary search for the rightmost timestamp at most t. Sorted-by-construction plus binary search is the recurring recipe.","Advanced Structures",
fact,Interview Prep,llm,"Hit counter trade-offs","A 5-minute hit counter: a queue of timestamps popped when stale is simple but memory scales with hits; a 300-slot circular buffer of per-second counts caps memory and trades exactness granularity. Presenting both with the trade-off is the complete answer.","Advanced Structures",
quiz,Interview Prep,llm,"Quiz: TimeMap retrieval","In a time-based key-value store, get(key, timestamp) returns the value at the largest time at most the query. Which technique finds it?","Advanced Structures","{""options"": [""Hash lookup by exact timestamp"", ""Binary search over that key's time-ordered list"", ""A max-heap of timestamps"", ""Linear scan from the front""], ""correct"": ""Binary search over that key's time-ordered list"", ""explain"": ""Writes arrive in increasing time order, so each key's list is sorted for free — a rightmost-at-most binary search answers get in O(log n).""}"
fact,Interview Prep,llm,"The simple three","Bubble sort swaps adjacent inversions repeatedly; selection sort pulls the minimum into place each round; insertion sort slides each element back into the sorted prefix. All O(n squared) — you know them to discuss, almost never to use.","Sorting",
fact,Interview Prep,llm,"Insertion sort's niche","Insertion sort earns its keep on nearly-sorted or tiny inputs: it runs in O(n + inversions), degrading gracefully. That is why production sorts like Timsort hand small runs to insertion sort — a great trivia beat when discussing built-ins.","Sorting",
fact,Interview Prep,llm,"Know the properties table","For each simple sort, know three attributes: complexity, stability, and in-place. Bubble and insertion are stable and in-place; selection is in-place but NOT stable in its common form. These attribute questions are cheap interview points.","Sorting",
