type,topic,source,title,body,tag,payload
fact,Interview Prep,llm,"Idempotent reprocessing","Design every stage to be safely re-runnable: name outputs deterministically per input, upsert rather than insert, checkpoint progress. When — not if — a worker dies mid-file, redelivery just works. Idempotency is the difference between a pipeline and a pile of scripts.","Design Exercises",
fact,Interview Prep,llm,"Grounding it in experience","If you have automated document processing — XML, PDFs, reports — USE that in this answer: real pain points (malformed inputs, partial failures, schema drift) and how you handled them beat textbook diagrams. Interviewers upgrade abstract answers that connect to shipped work.","Design Exercises",
quiz,Interview Prep,llm,"Quiz: The poison file","One malformed file crashes its worker repeatedly on redelivery. What design element contains the damage?","Design Exercises","{""options"": [""Bigger workers"", ""A dead-letter queue after N failed attempts, with alerting"", ""Deleting the file silently"", ""Processing files in one thread""], ""correct"": ""A dead-letter queue after N failed attempts, with alerting"", ""explain"": ""Retry limits plus a DLQ quarantine the poison message so the pipeline keeps flowing, while alerting ensures a human investigates. Silent deletion loses data; infinite retries block the queue.""}"
fact,Interview Prep,llm,"Autocomplete's engine","Typeahead is the trie's showcase: descend to the typed prefix, return the top suggestions below it. The optimization that makes it real: cache the top-k completions AT each node during construction, so queries stop descending and read precomputed answers — O(prefix length).","Design Exercises",
fact,Interview Prep,llm,"Ranking and freshness","Suggestions rank by score — frequency, recency, personalization. Updating scores on every keystroke query is too hot; real designs batch-aggregate search logs and rebuild or patch the trie periodically. Separate the serve path (read-only, fast) from the update path (offline, batch).","Design Exercises",
fact,Interview Prep,llm,"Scale and latency","Autocomplete budgets ~100 milliseconds per keystroke: serve from memory, shard the trie by prefix range if it outgrows one machine, and debounce on the client. This question chains data structure, ranking, and systems — practice narrating all three layers in order.","Design Exercises",
quiz,Interview Prep,llm,"Quiz: Fast suggestions","What precomputation makes autocomplete queries O(prefix length) instead of O(subtree size)?","Design Exercises","{""options"": [""Sorting the dictionary"", ""Storing the top-k completions at every trie node"", ""Hashing each prefix"", ""Binary search on words""], ""correct"": ""Storing the top-k completions at every trie node"", ""explain"": ""Without caching, each query walks the prefix's entire subtree to collect and rank candidates. With per-node top-k lists, the query descends the prefix and reads the answer — subtree exploration eliminated.""}"
fact,Interview Prep,llm,"News feed, the two strategies","Feed design's central axis: fan-out on WRITE pushes each new post into followers' precomputed feed lists (fast reads, heavy writes) versus fan-out on READ assembling the feed per request (cheap writes, expensive reads). Awareness tier — the axis is the answer.","Design Exercises",
fact,Interview Prep,llm,"The celebrity problem","Fan-out on write breaks on accounts with millions of followers — one post triggers millions of writes. Real systems hybridize: push for normal users, pull for celebrities, merging at read time. Naming the celebrity problem is the recognized shibboleth for this question.","Design Exercises",
fact,Interview Prep,llm,"Feed answer calibration","At intern level, a complete answer: the two fan-out strategies, the hybrid, feeds cached in Redis as sorted lists, ranking as a swappable scoring step. Do not descend into ML ranking — breadth over depth matches the awareness-level ask.","Design Exercises",
quiz,Interview Prep,llm,"Quiz: The celebrity post","Why does pure fan-out-on-write fail for an account with 50 million followers?","Design Exercises","{""options"": [""Followers cannot read that fast"", ""One post triggers 50 million feed writes — a write amplification explosion"", ""Timelines cannot store posts"", ""It violates CAP""], ""correct"": ""One post triggers 50 million feed writes — a write amplification explosion"", ""explain"": ""Precomputing every follower's feed multiplies each celebrity post into tens of millions of operations. The hybrid keeps push for normal accounts and pulls celebrity posts at read time.""}"
fact,Interview Prep,llm,"Scaling your project 100x","The scale-your-project question tests whether you can apply the blocks to something REAL. The template: name the current architecture honestly, identify the first bottleneck at 100x, fix it with a standard block, then repeat — bottleneck by bottleneck, not buzzword by buzzword.","Design Exercises",
fact,Interview Prep,llm,"A concrete escalation","Example arc for a single-machine automation script: parallelize with a worker pool; then a queue decouples ingestion from processing; then workers scale horizontally; then the database or filesystem becomes the constraint — move artifacts to object storage, results to a proper DB, add observability.","Design Exercises",
fact,Interview Prep,llm,"Honesty as strategy","Admitting current limits is the strength move: it is a cron job on one box, and here is exactly what breaks first shows self-awareness that inflated descriptions destroy. Interviewers push until they find the edge of your understanding — place the edge yourself, then reason past it.","Design Exercises",
quiz,Interview Prep,llm,"Quiz: The 100x method","What is the strongest structure for answering how would you scale your project 100x?","Design Exercises","{""options"": [""List every AWS service"", ""Identify the first bottleneck, fix it with a standard block, repeat"", ""Rewrite in a faster language"", ""Say it already scales""], ""correct"": ""Identify the first bottleneck, fix it with a standard block, repeat"", ""explain"": ""Sequential bottleneck reasoning demonstrates understanding of YOUR system and the building blocks. Service name-dropping without a bottleneck narrative signals memorization, not engineering.""}"
fact,Interview Prep,llm,"OO design conversation","Class-design questions grade a conversation: propose classes and interfaces, justify responsibilities (single responsibility per class), and show relationships — composition arrows over inheritance trees. A rough boxes-and-lines sketch beats UML formality; clarity is the rubric.","Design Exercises",
fact,Interview Prep,llm,"Extensibility as the test","Every OO design question hides an extensibility probe: interfaces at variation points (payment methods, notification channels, pricing rules) let the inevitable now add X land as a new implementation, not an edit. Design FOR the follow-up you know is coming.","Design Exercises",
fact,Interview Prep,llm,"SOLID, applied lightly","Wield SOLID as reasons, not recitals: this class has one reason to change (S), we extend by adding classes not editing them (O), callers depend on the interface not the concrete type (D). One principle per design decision, invoked naturally, reads as fluency.","Design Exercises",
quiz,Interview Prep,llm,"Quiz: The variation point","A vending machine design must anticipate new payment methods. What structure prepares for that?","Design Exercises","{""options"": [""A payment switch statement"", ""A PaymentMethod interface with one implementation per method"", ""Hardcoding card and cash"", ""A global payment flag""], ""correct"": ""A PaymentMethod interface with one implementation per method"", ""explain"": ""New methods become new classes implementing the contract — zero edits to the machine logic. The switch statement grows and risks breaking existing paths on every addition: open-closed violated.""}"
fact,Interview Prep,llm,"The loop's anatomy","Google's intern and new-grad path: recruiter screen, an online assessment, then typically two 45-minute technical interviews (virtual, shared editor), and for interns a host-matching phase where teams pick from the pool. Knowing the stages kills the ambient anxiety of not knowing what is next.","Interview Loop",
fact,Interview Prep,llm,"What each stage screens","The recruiter screen checks basics and logistics; the OA filters on coding mechanics; the technical interviews grade problem solving, code quality, and communication via written feedback; hiring committee reviews the packet. No single interviewer decides — the packet does.","Interview Loop",
fact,Interview Prep,llm,"Feedback is written, not felt","Interviewers write detailed feedback with your code attached — which means the ARTIFACT matters: clean code, stated complexity, and visible reasoning survive into the packet even if you felt shaky. Optimize for what the written record shows, not the vibe in the room.","Interview Loop",
quiz,Interview Prep,llm,"Quiz: Who decides","At Google, who ultimately decides a candidate's outcome?","Interview Loop","{""options"": [""The last interviewer"", ""A committee reviewing all written feedback"", ""The recruiter"", ""The team's manager alone""], ""correct"": ""A committee reviewing all written feedback"", ""explain"": ""Individual interviewers submit written assessments; a hiring committee weighs the whole packet. One rough interview rarely sinks a strong packet — which should lower the stakes of any single round.""}"
fact,Interview Prep,llm,"OA strategy","Online assessment tactics: read ALL problems first and order by confidence; passing partial test cases beats one perfect solution and one blank; brute force that passes some cases outscores elegant code that never ran. Banked partial credit is the OA meta-game.","Interview Loop",
fact,Interview Prep,llm,"Environment discipline","Treat the OA like a flight: quiet room, stable connection, water, phone away, and a timer strategy per problem decided BEFORE starting. Practice one full-length timed mock in the same chair — rehearsing logistics removes a whole category of avoidable failure.","Interview Loop",
fact,Interview Prep,llm,"The snapshot questionnaire","Some Google processes include a work-style questionnaire (a behavioral snapshot). Answer honestly and consistently — it is normed against inconsistency — and do not overthink it: it screens patterns, not trick answers. Save your optimization energy for the coding.","Interview Loop",
quiz,Interview Prep,llm,"Quiz: OA triage","You open an OA with two problems and 90 minutes. What is the strongest opening move?","Interview Loop","{""options"": [""Start problem 1 immediately"", ""Read both problems, then start with the one you can score on fastest"", ""Spend 45 minutes planning"", ""Write tests first for both""], ""correct"": ""Read both problems, then start with the one you can score on fastest"", ""explain"": ""Partial credit across both problems usually beats perfection on one. Triage first: bank the accessible points, then invest remaining time where marginal score is highest.""}"
fact,Interview Prep,llm,"The barebones editor","Google interviews use a shared doc or minimal editor: no autocomplete, no syntax highlighting, no run button. Code that has only ever been written with IDE assistance falls apart there — practice in a plain text file until your syntax stands on its own.","Interview Loop",
fact,Interview Prep,llm,"You are the compiler","No run button means YOU verify: trace variables by hand, check off-by-ones deliberately, know your standard library signatures cold. The habit to build: after writing, walk one concrete input through every line, updating a small state table aloud.","Interview Loop",
fact,Interview Prep,llm,"Practice the medium","Two weeks before the loop, shift practice into the real medium: plain editor, talking aloud, 40-minute timer, self-trace instead of running. The skills are separable from problem-solving — and they are trainable in days once you stop practicing with a crutch.","Interview Loop",
quiz,Interview Prep,llm,"Quiz: No run button","Without a run button, how do you verify your interview code?","Interview Loop","{""options"": [""Assert confidence and move on"", ""Trace a small concrete input through every line, tracking state by hand"", ""Ask the interviewer to run it"", ""Rewrite it twice""], ""correct"": ""Trace a small concrete input through every line, tracking state by hand"", ""explain"": ""Manual tracing IS the test suite in the room. A visible, careful walkthrough catches off-by-ones and demonstrates the verification discipline interviewers grade for.""}"
fact,Interview Prep,llm,"Clarify before solving","Never start coding on an unclarified problem. Restate it in your own words, then sweep the checklist: input size and ranges, duplicates, negatives, empty input, sortedness, mutability of input, and exact output format. Two minutes of questions routinely saves twenty of rework.","UMPIRE Protocol",
fact,Interview Prep,llm,"Questions reveal seniority","Which questions you ask IS signal: asking about input scale shows you connect constraints to complexity; asking about duplicates and empties shows edge-case instincts. Interviewers often leave the problem deliberately underspecified to see if you notice.","UMPIRE Protocol",
fact,Interview Prep,llm,"Confirm the contract","End clarification by confirming the contract: so given X, I return Y, and for this edge I return Z — correct? A nodded agreement locks the target and protects you from solving the wrong problem, the most expensive failure available in 45 minutes.","UMPIRE Protocol",
quiz,Interview Prep,llm,"Quiz: The underspecified problem","The interviewer gives a vague problem statement. What does that most likely mean?","UMPIRE Protocol","{""options"": [""They forgot the details"", ""Ambiguity is intentional — clarifying is part of the test"", ""You should guess silently"", ""The problem is broken""], ""correct"": ""Ambiguity is intentional — clarifying is part of the test"", ""explain"": ""Real engineering starts from incomplete requirements. Surfacing assumptions and asking targeted questions is a graded behavior, not a delay before the real interview.""}"
fact,Interview Prep,llm,"Work an example first","Before any code, run a small concrete example by hand — write the input, produce the output manually, and notice WHAT your brain did to get there. The manual process often reveals the algorithm; examples are cheap discovery, code is expensive discovery.","UMPIRE Protocol",
fact,Interview Prep,llm,"Choose examples that teach","A good example is small enough to trace but rich enough to be honest: include a duplicate, a negative, or a tie if the problem allows them. A too-trivial example validates wrong algorithms; one deliberately tricky case inoculates your design early.","UMPIRE Protocol",
fact,Interview Prep,llm,"Examples as shared artifacts","Write the example where the interviewer can see it and reuse it later for tracing and testing. It becomes the shared reference point of the whole session — and reaching for it during verification looks organized because it is.","UMPIRE Protocol",
quiz,Interview Prep,llm,"Quiz: Why hand-solve first","What is the main payoff of solving a small example by hand before designing the algorithm?","UMPIRE Protocol","{""options"": [""It fills time"", ""Your manual process often reveals the algorithm and hidden cases"", ""It replaces complexity analysis"", ""It impresses without content""], ""correct"": ""Your manual process often reveals the algorithm and hidden cases"", ""explain"": ""Watching yourself solve the instance exposes the operations that matter — sort first, track a running max — and surfaces ambiguities while they are still free to fix.""}"
fact,Interview Prep,llm,"State the brute force","Always name the brute force and its complexity BEFORE optimizing: the naive approach checks all pairs in O(n squared); now let us beat it. It banks a working answer, anchors the optimization story, and proves you know where the baseline sits.","UMPIRE Protocol",
fact,Interview Prep,llm,"Brute force is not failure","Interviewers prefer a stated brute force to silence: it shows the problem is understood and gives them something to steer. If time collapses, a coded brute force with honest complexity beats a half-coded optimum every single time.","UMPIRE Protocol",
fact,Interview Prep,llm,"Mine it for the optimization","The brute force usually CONTAINS the optimization: what work does it repeat? Recomputed sums become prefix sums; repeated lookups become a hash map; re-scanned windows become sliding windows. Interrogating the waste is the most reliable route to the intended solution.","UMPIRE Protocol",
quiz,Interview Prep,llm,"Quiz: The waste question","After stating a brute force, which question most reliably leads to the optimization?","UMPIRE Protocol","{""options"": [""What data structure is trendy?"", ""What work is this repeating that could be cached or maintained incrementally?"", ""Can I write it in fewer lines?"", ""Would recursion look better?""], ""correct"": ""What work is this repeating that could be cached or maintained incrementally?"", ""explain"": ""Redundant computation is the optimization's raw material: repeated lookups become hash maps, recomputed aggregates become prefix sums or sliding windows, repeated subproblems become DP.""}"
fact,Interview Prep,llm,"Name the pattern","Optimization lands best as a named pattern with a justification: because the array is sorted, two pointers can discard candidates safely — O(n). Naming the pattern (hash map, heap, binary search on the answer, DP) plus the property that licenses it is the whole move.","UMPIRE Protocol",
fact,Interview Prep,llm,"Justify with the constraint","Tie improvements to the constraints: n is 10 to the 5, so O(n squared) is 10 billion operations — we need roughly O(n log n). Constraint-driven reasoning shows the optimization is chosen, not remembered. Interviewers explicitly listen for it.","UMPIRE Protocol",
fact,Interview Prep,llm,"Know when to stop","Optimal enough exists: if you reach the intended complexity, say whether further improvement is possible and at what cost, then move to coding. Chasing a marginal constant factor while the clock burns is a calibration failure — the interview rewards finished over fancy.","UMPIRE Protocol",
quiz,Interview Prep,llm,"Quiz: Selling the optimization","Which statement best presents an optimization?","UMPIRE Protocol","{""options"": [""I have seen this before, the answer is a heap"", ""Since we only ever need the smallest active item, a min-heap maintains it in O(log n) per step, cutting the scan from O(n squared) to O(n log n)"", ""Heaps are usually good"", ""Let me just code and see""], ""correct"": ""Since we only ever need the smallest active item, a min-heap maintains it in O(log n) per step, cutting the scan from O(n squared) to O(n log n)"", ""explain"": ""It names the structure, the property justifying it, and the quantified improvement — reasoning made audible, which is precisely what the feedback form asks interviewers to assess.""}"
fact,Interview Prep,llm,"Plan before code","Before typing, outline: the data structures, the loop structure, and the key invariant, in three or four spoken or written lines. The plan catches design flaws while they cost seconds — and gives the interviewer a chance to redirect BEFORE you build the wrong thing.","UMPIRE Protocol",
fact,Interview Prep,llm,"Pseudocode as checkpoint","A brief pseudocode sketch doubles as an agreement checkpoint: I will sort by end time, then greedily keep non-overlapping — sound reasonable? An interviewer's nod here is cheap insurance; their frown is priceless, because it arrives before the rewrite.","UMPIRE Protocol",
fact,Interview Prep,llm,"Proportional planning","Calibrate planning to difficulty: a two-line plan for an easy problem, a real outline with helper responsibilities for a hard one. Over-planning trivial problems wastes clock; under-planning hard ones creates mid-code architecture changes — the visible flailing to avoid.","UMPIRE Protocol",
quiz,Interview Prep,llm,"Quiz: The nod's value","Why checkpoint your plan with the interviewer before coding?","UMPIRE Protocol","{""options"": [""To transfer blame"", ""Course corrections cost seconds at plan time and minutes mid-code"", ""It is required protocol"", ""To avoid complexity analysis""], ""correct"": ""Course corrections cost seconds at plan time and minutes mid-code"", ""explain"": ""Interviewers often hint at plan stage — hmm, what about duplicates? Catching a flaw before implementation preserves your clock and reads as collaborative engineering.""}"
fact,Interview Prep,llm,"Narrate while coding","Code aloud at the DECISION level: I am using a dummy head so deletions need no special case — not I am typing a for loop. Silence during coding forfeits the communication score; over-narration of syntax wastes breath. Narrate choices, not keystrokes.","UMPIRE Protocol",
fact,Interview Prep,llm,"Real names, clean structure","Variable names carry weight in the written packet: left, right, windowSum, lastSeen — never a, b, temp2. Extract a helper when a block has a nameable job. The five extra seconds per name repay themselves in interviewer comprehension and feedback quality.","UMPIRE Protocol",
fact,Interview Prep,llm,"Stuck mid-implementation","When stuck WHILE coding, say so productively: this index bookkeeping is off — let me re-trace the example at this line. Naming the difficulty keeps the interviewer engaged and often triggers a hint; silent freezing reads as lost even when you are close.","UMPIRE Protocol",
quiz,Interview Prep,llm,"Quiz: Useful narration","Which running commentary adds the most value while coding?","UMPIRE Protocol","{""options"": [""Now I type a colon"", ""I check the map before inserting, so an element never pairs with itself"", ""Python is my favorite language"", ""Almost done, probably""], ""correct"": ""I check the map before inserting, so an element never pairs with itself"", ""explain"": ""It exposes a design decision and the bug it prevents — reasoning the interviewer can grade. Syntax narration and filler add nothing to the packet.""}"
fact,Interview Prep,llm,"The line-by-line trace","After coding, verify BEFORE declaring done: pick the small example, walk every line, and track variables in a little state table aloud. Finding your own off-by-one during the trace is a POSITIVE signal — self-verification is a graded engineering behavior.","UMPIRE Protocol",
fact,Interview Prep,llm,"The edge-case sweep","After the happy-path trace, sweep edges deliberately: empty input, single element, all duplicates, the extremes of the constraints. Announce each — empty array: the loop does not execute, we return zero, correct. Thirty seconds, and it closes the most common bug reports.","UMPIRE Protocol",
fact,Interview Prep,llm,"Own your bugs calmly","When the trace exposes a bug, fix the CAUSE without drama: narrate the diagnosis, apply the fix, re-trace the affected part. Composure during self-repair is worth more than a bug-free first draft — interviewers know which one predicts on-the-job behavior.","UMPIRE Protocol",
quiz,Interview Prep,llm,"Quiz: Finding your own bug","During your verification trace you spot an off-by-one. How does this affect your evaluation?","UMPIRE Protocol","{""options"": [""It is disqualifying"", ""Positively — catching and fixing your own bugs demonstrates the verification habit"", ""Neutrally, bugs are ignored"", ""Only the first draft counts""], ""correct"": ""Positively — catching and fixing your own bugs demonstrates the verification habit"", ""explain"": ""Interviewers grade the process: candidates who systematically verify and self-correct are exactly who you want touching production code. Declaring done without tracing is the actual red flag.""}"
fact,Interview Prep,llm,"Complexity, always, unprompted","End every solution with the complexity statement before being asked: time O(n log n) from the sort dominating the linear sweep; space O(n) for the map. Attribute each term to its source. Waiting to be asked converts a strength into a prompted answer.","UMPIRE Protocol",
fact,Interview Prep,llm,"Attribute the terms","Naming WHERE complexity comes from proves understanding: the sort costs n log n, each element enters the heap once at log k. Bare answers like O(n log n) I think invite exactly the probing that attribution preempts.","UMPIRE Protocol",
fact,Interview Prep,llm,"State both cases when they differ","When average and worst diverge — hashing, quicksort — say both and note which matters here: O(1) average per lookup, O(n) pathological, not a practical concern for this input. That sentence is the difference between knowing the answer and knowing the material.","UMPIRE Protocol",
quiz,Interview Prep,llm,"Quiz: The complete statement","Which complexity statement is complete for a sort-then-scan solution using a hash set?","UMPIRE Protocol","{""options"": [""Pretty fast"", ""O(n log n)"", ""Time O(n log n) dominated by the sort; the scan is O(n); space O(n) for the set"", ""It depends""], ""correct"": ""Time O(n log n) dominated by the sort; the scan is O(n); space O(n) for the set"", ""explain"": ""Both time AND space, each attributed to its source. This is expected UNPROMPTED after every solution — one of the cheapest consistently-awarded points in the loop.""}"
fact,Interview Prep,llm,"Follow-ups are the plan","The follow-up IS the interview design: what if the array does not fit in memory, what if inputs stream, what if k changes per query. Treat constraint changes as new constraints to reason from — restate what broke and which tool replaces it.","UMPIRE Protocol",
