type,topic,source,title,body,tag,payload
fact,Interview Prep,llm,"Negative mods","Languages disagree on negative remainders: Python's mod is always non-negative; Java and C++ can return negatives. The portable fix: ((x mod m) plus m) mod m. Circular index arithmetic is where this bites hardest.","Math & Misc",
fact,Interview Prep,llm,"Division needs inverses","Mod does NOT distribute over division — dividing requires the modular multiplicative inverse, via Fermat's little theorem when the modulus is prime. Awareness level: know division-under-mod is special, and name the inverse if pressed.","Math & Misc",
quiz,Interview Prep,llm,"Quiz: Portable negative mod","Which expression guarantees a non-negative result for x mod m across Java, C++, and Python?","Math & Misc","{""options"": [""x % m"", ""((x % m) + m) % m"", ""abs(x) % m"", ""x % (m + 1)""], ""correct"": ""((x % m) + m) % m"", ""explain"": ""Java and C++ can return a negative remainder for negative x; adding m and reducing again normalizes it. abs changes the ANSWER for negative x — a subtle wrong fix.""}"
fact,Interview Prep,llm,"Fast exponentiation","pow(x, n) in O(log n): square x while halving n, multiplying the result in whenever n's current bit is odd. The naive n-multiplication loop is the wrong answer this question exists to disqualify.","Math & Misc",
fact,Interview Prep,llm,"The edge cases","Negative exponents invert: pow(x, negative n) equals one over pow(x, n) — and in fixed-width languages negating INT_MIN overflows, so handle n as a long. Zero to the zero is conventionally one here. Edge handling is half this problem's grade.","Math & Misc",
fact,Interview Prep,llm,"Squaring powers everything","Exponentiation by squaring generalizes beyond numbers: the same halving applies to matrix powers (Fibonacci in O(log n)) and to repeated function composition. Recognize compute the n-th anything with an associative combine as this pattern.","Math & Misc",
quiz,Interview Prep,llm,"Quiz: pow complexity","What is the time complexity of exponentiation by squaring for pow(x, n)?","Math & Misc","{""options"": [""O(n)"", ""O(log n)"", ""O(sqrt n)"", ""O(1)""], ""correct"": ""O(log n)"", ""explain"": ""Each squaring halves the exponent, so the loop runs once per bit of n. A billion-power needs about 30 multiplications instead of a billion.""}"
fact,Interview Prep,llm,"Atoi's gauntlet","String to integer runs a fixed gauntlet: skip leading whitespace, consume one optional sign, read digits until a non-digit, clamp on overflow to the integer limits. Enumerating those steps aloud BEFORE coding is the intended demonstration of rigor.","Math & Misc",
fact,Interview Prep,llm,"Reverse integer","Reverse integer peels digits with mod ten and rebuilds with times ten plus digit — checking the overflow BEFORE each rebuild step in fixed-width languages. Python needs a manual range check at the end instead, plus care with negative signs.","Math & Misc",
fact,Interview Prep,llm,"Palindrome number without strings","Palindrome number, no string conversion: reverse only HALF the number — stop when the reversed part reaches the remaining part — and compare, with an odd-length middle digit dropped by dividing by ten. Negative numbers fail immediately by the sign.","Math & Misc",
quiz,Interview Prep,llm,"Quiz: Atoi order of operations","In atoi, which step order is correct?","Math & Misc","{""options"": [""Digits, sign, whitespace"", ""Whitespace, sign, digits, clamp on overflow"", ""Sign, whitespace, digits"", ""Clamp, digits, sign""], ""correct"": ""Whitespace, sign, digits, clamp on overflow"", ""explain"": ""Leading spaces are skipped first, exactly one sign may follow, digits accumulate until any non-digit stops parsing, and out-of-range values clamp to the integer limits.""}"
fact,Interview Prep,llm,"Fisher-Yates shuffle","Uniform shuffle: iterate i from the end down, swapping position i with a uniformly random position from 0 through i. Every permutation becomes equally likely — the naive swap-with-anywhere-every-step version is provably biased.","Math & Misc",
fact,Interview Prep,llm,"Reservoir sampling","Pick k uniform samples from a stream of unknown length: keep the first k, then replace a random reservoir slot for item i with probability k over i. Linked list random node and random pick index are the k equals one form. The proof is a neat induction — sketch it if asked.","Math & Misc",
fact,Interview Prep,llm,"Rejection sampling","Generate a small uniform range from a bigger one by rejecting overflow: rand10 from rand7 composes two calls into 49 outcomes, keeps 40, retries otherwise. Expected calls stay constant. The keep-a-multiple-of-the-target detail is where correctness lives.","Math & Misc",
quiz,Interview Prep,llm,"Quiz: Reservoir replacement","In reservoir sampling with k=1, with what probability does stream item i (1-indexed) replace the current pick?","Math & Misc","{""options"": [""1/2"", ""1/i"", ""1/k"", ""It never replaces""], ""correct"": ""1/i"", ""explain"": ""Accepting item i with probability 1/i leaves every item seen so far with exactly 1/i survival probability — the induction that makes single-pass uniform sampling of unknown-length streams possible.""}"
fact,Interview Prep,llm,"Distance and comparisons","Euclidean distance needs a square root — but COMPARING distances does not: compare squared distances and skip the sqrt, avoiding floating point entirely. K closest points runs entirely on squared magnitudes.","Math & Misc",
fact,Interview Prep,llm,"Rectangle overlap","Two axis-aligned rectangles overlap unless one is fully left, right, above, or below the other — check the four separations and negate. Overlap AREA multiplies the two 1D interval overlaps: max(0, min of rights minus max of lefts) per axis.","Math & Misc",
fact,Interview Prep,llm,"Collinearity without division","Max points on a line groups by slope — but raw float slopes collide on precision. Use reduced fraction pairs (dy over gcd, dx over gcd) with a sign convention as hash keys, or check collinearity by cross product: (y2-y1)(x3-x1) equals (y3-y1)(x2-x1). No division, no epsilon.","Math & Misc",
quiz,Interview Prep,llm,"Quiz: Avoiding float slopes","How do you group points by slope without floating point precision bugs?","Math & Misc","{""options"": [""Round slopes to 6 decimals"", ""Use reduced (dy, dx) fraction pairs as keys"", ""Multiply slopes by 1000"", ""Use doubles instead of floats""], ""correct"": ""Use reduced (dy, dx) fraction pairs as keys"", ""explain"": ""Dividing dy and dx by their GCD with a normalized sign yields an exact canonical key per direction. Rounding merely relocates the precision failures.""}"
fact,Interview Prep,llm,"Permutations vs combinations counting","Order matters: permutations P(n, k) equals n factorial over (n minus k) factorial. Order ignored: combinations C(n, k) divides that by k factorial. The interview reflex is mapping does order matter in this problem to the right formula before counting anything.","Math & Misc",
fact,Interview Prep,llm,"Pascal's triangle","Pascal's triangle rows ARE binomial coefficients: each entry is the sum of the two above, mirroring the identity C(n, k) equals C(n-1, k-1) plus C(n-1, k). Generating row n iteratively in O(n) space is the standard easy question hiding this identity.","Math & Misc",
fact,Interview Prep,llm,"Computing C(n, k) safely","Compute C(n, k) multiplicatively — result times (n minus i) over (i plus 1) for i from 0 — never via full factorials, which overflow fast. Symmetry C(n, k) equals C(n, n-k) halves the loop. Counting paths in a grid is C(m plus n minus 2, m minus 1) — connect the dots.","Math & Misc",
quiz,Interview Prep,llm,"Quiz: Order or not","Choosing a 3-person committee from 10 people uses which count?","Math & Misc","{""options"": [""P(10, 3) = 720"", ""C(10, 3) = 120"", ""10 cubed"", ""3 to the 10th""], ""correct"": ""C(10, 3) = 120"", ""explain"": ""A committee has no ordering among members, so divide the 720 ordered selections by 3 factorial arrangements each — combinations, not permutations.""}"
fact,Interview Prep,llm,"Matrix exponentiation","Linear recurrences accelerate to O(log n): express the state transition as a matrix and raise it by fast exponentiation — Fibonacci via powers of [[1,1],[1,0]]. Awareness tier: name the technique when n is astronomically large, like 10 to the 18.","Math & Misc",
fact,Interview Prep,llm,"When it is the intended tool","The signal: a DP with O(1)-size state but an input size no linear loop can touch. Climbing stairs for n equals 10 to the 15 or counting length-n strings avoiding a pattern — the transition matrix is small, and log n powers of it finish instantly.","Math & Misc",
fact,Interview Prep,llm,"Framing it in the room","One sentence suffices: this recurrence is linear, so I would encode it as a 2x2 matrix and use exponentiation by squaring for O(log n). Then solve the expected linear version unless the interviewer redirects — calibration over showmanship.","Math & Misc",
quiz,Interview Prep,llm,"Quiz: Fibonacci at scale","Computing the 10-to-the-18th Fibonacci number modulo a prime calls for which technique?","Math & Misc","{""options"": [""Memoized recursion"", ""Matrix exponentiation"", ""A bigger array"", ""Binet's formula with floats""], ""correct"": ""Matrix exponentiation"", ""explain"": ""O(n) loops cannot touch 10 to the 18 steps; raising the 2x2 Fibonacci transition matrix to the n-th power by squaring takes about 60 matrix multiplications. Floats lose precision long before.""}"
fact,Interview Prep,llm,"Integer square root","sqrt(x) truncated to an integer: binary search the answer space for the largest m with m squared at most x — guarding overflow by comparing m against x over m instead of squaring in fixed-width languages. O(log x), the expected interview solution.","Math & Misc",
fact,Interview Prep,llm,"Newton's method","Newton's iteration for square roots: repeatedly set guess to the average of guess and x over guess. It converges quadratically — correct digits roughly double per step — and is how real math libraries do it. Offering it after binary search shows depth.","Math & Misc",
fact,Interview Prep,llm,"Perfect squares and friends","Valid perfect square is the same binary search demanding exact equality. sqrt-adjacent problems recur across arithmetic puzzles — bucket counting in O(sqrt n) blocks and factor-pair enumeration to the root reuse the same square-root boundary logic.","Math & Misc",
quiz,Interview Prep,llm,"Quiz: Newton's update","Newton's method computes sqrt(x) by iterating which update on the current guess g?","Math & Misc","{""options"": [""g = g / 2"", ""g = (g + x / g) / 2"", ""g = x - g * g"", ""g = g * g / x""], ""correct"": ""g = (g + x / g) / 2"", ""explain"": ""Averaging g with x over g is the Newton step for the function g squared minus x, converging quadratically — far faster per iteration than binary search's single bit.""}"
fact,Interview Prep,llm,"Merge intervals, the anchor problem","Merge intervals anchors the whole cluster: sort by start, keep a growing merged interval, extend its end with a max on overlap, emit and restart on a gap. Overlap test after sorting is simply next start at most current end.","Intervals & Sweep",
fact,Interview Prep,llm,"Touching or not","Decide with the interviewer whether touching intervals — one ends at 5, the next starts at 5 — merge. The comparison flips between at most and strictly less, and both conventions appear in real problems. Asking is a clarity point, not pedantry.","Intervals & Sweep",
fact,Interview Prep,llm,"The cluster map","Interval questions decompose into three moves: sort (by start or end — the choice IS the algorithm), sweep with running state, and sometimes a heap for concurrent resources. Naming which move a new problem needs is pattern recognition paying rent.","Intervals & Sweep",
quiz,Interview Prep,llm,"Quiz: Post-sort overlap test","After sorting intervals by start, the next interval overlaps the current merged one exactly when...","Intervals & Sweep","{""options"": [""next.end > current.start"", ""next.start <= current.end"", ""next.start == current.start"", ""They never overlap after sorting""], ""correct"": ""next.start <= current.end"", ""explain"": ""Sorting guarantees next.start is at least current.start, so overlap reduces to the single boundary comparison — the simplification that makes the one-pass sweep valid.""}"
fact,Interview Prep,llm,"Insert interval","Insert interval exploits the input's existing sorted, disjoint structure: emit all intervals ending before the new one, absorb every overlapping interval into it with min-start and max-end, then emit it and the untouched rest. O(n), no re-sorting.","Intervals & Sweep",
fact,Interview Prep,llm,"Three-phase framing","Framing it aloud as three phases — before, merge, after — before typing converts a fiddly index problem into three tiny loops. Most failed attempts come from interleaving the phases into one loop with tangled conditions.","Intervals & Sweep",
fact,Interview Prep,llm,"Why not just re-sort","Appending and re-running merge intervals works at O(n log n) — say it as the baseline, then note the sorted input invites the O(n) three-phase scan. Improving on a correct baseline you named yourself is the ideal interview arc.","Intervals & Sweep",
quiz,Interview Prep,llm,"Quiz: Absorbing overlaps","During insert interval's merge phase, the new interval absorbs an overlapping interval by taking which bounds?","Intervals & Sweep","{""options"": [""Min of starts, max of ends"", ""Max of starts, min of ends"", ""The new interval's bounds always"", ""The older interval's bounds""], ""correct"": ""Min of starts, max of ends"", ""explain"": ""The union of two overlapping intervals spans from the earlier start to the later end. Max-start with min-end computes their INTERSECTION — the other problem.""}"
fact,Interview Prep,llm,"Interval list intersections","Intersecting two sorted interval lists: two pointers; the intersection of the current pair is max of starts to min of ends (keep it when nonempty), then advance whichever interval ENDS first — it can intersect nothing further. O(n plus m).","Intervals & Sweep",
fact,Interview Prep,llm,"Advance the earlier end","Advancing the earlier-ending interval is the correctness crux: the later-ending one might still overlap the other list's next interval. It is the interval analogue of merge's take-the-smaller-head — the same two-pointer soul.","Intervals & Sweep",
fact,Interview Prep,llm,"Intersection vs union vocabulary","Keep the two formulas paired mentally: union is min-start to max-end (merging), intersection is max-start to min-end (overlapping region, valid only when start is at most end). Half the interval bugs in interviews are these two swapped.","Intervals & Sweep",
quiz,Interview Prep,llm,"Quiz: Which pointer moves","In interval list intersections with two pointers, after emitting an intersection, which side advances?","Intervals & Sweep","{""options"": [""The one that started earlier"", ""The one that ends earlier"", ""Both always"", ""The shorter interval's list""], ""correct"": ""The one that ends earlier"", ""explain"": ""An interval that has ended can never intersect anything else, while the longer-lasting one may still overlap the other list's next entry. Ending time, not starting time, drives the advance.""}"
fact,Interview Prep,llm,"Minimum rooms, two engines","Minimum meeting rooms solves two ways: a min-heap of end times (pop when a room frees, peak size is the answer) or a sweep over sorted plus-one and minus-one events. Same O(n log n); the sweep also answers WHEN the peak occurs.","Intervals & Sweep",
fact,Interview Prep,llm,"The split-array variant","The sweep's slick implementation sorts starts and ends as two separate arrays and walks them with two pointers — a start before the next end opens a room, otherwise one closes. No event objects, no tuples, same counting.","Intervals & Sweep",
fact,Interview Prep,llm,"Presenting both","Offering both engines and their trade-off — the heap generalizes to WHICH room hosts which meeting, the sweep to full concurrency timelines — turns a standard medium into a design conversation. That pivot is where senior signal lives.","Intervals & Sweep",
quiz,Interview Prep,llm,"Quiz: Heap size meaning","In the min-heap solution to meeting rooms II, what does the heap's maximum size over the run represent?","Intervals & Sweep","{""options"": [""Total meetings"", ""The minimum number of rooms needed"", ""The longest meeting"", ""Overlap of the first two meetings""], ""correct"": ""The minimum number of rooms needed"", ""explain"": ""Each heap entry is an occupied room's end time; entries coexist exactly while meetings overlap. The high-water mark is the peak simultaneous demand — the room requirement.""}"
fact,Interview Prep,llm,"Employee free time","Employee free time flattens everyone's schedules into one list, sorts, merges busy intervals — and reads the answer from the GAPS between merged blocks. Finding free time is merging busy time and inverting; the inversion is the entire insight.","Intervals & Sweep",
fact,Interview Prep,llm,"Gaps as first-class objects","The gap-reading pattern recurs: available slots between bookings, idle CPU windows, uncovered ranges after merging coverage. Whenever a problem asks where is there NOTHING, merge the somethings and walk the seams.","Intervals & Sweep",
fact,Interview Prep,llm,"The k-list refinement","With k employees' sorted schedules, a heap-based k-way merge feeds the sweep in O(n log k) instead of flatten-and-sort's O(n log n) — the meet-the-family moment where interval merging and merge k lists shake hands. Mention it as the scalable refinement.","Intervals & Sweep",
quiz,Interview Prep,llm,"Quiz: Free time inversion","Employee free time is computed by which two-step move?","Intervals & Sweep","{""options"": [""Intersect all busy intervals, output them"", ""Merge all busy intervals, output the gaps between merged blocks"", ""Sort by end and count"", ""Binary search each hour""], ""correct"": ""Merge all busy intervals, output the gaps between merged blocks"", ""explain"": ""Free time is the complement of anyone-is-busy time. Merging produces disjoint busy blocks, and the intervals between consecutive blocks are exactly the common free windows.""}"
fact,Interview Prep,llm,"My Calendar I","Design a calendar rejecting double bookings: keep bookings in a sorted map keyed by start; a new event checks only its floor (must end by the new start) and ceiling (must start at or after the new end) neighbors. O(log n) per booking.","Intervals & Sweep",
fact,Interview Prep,llm,"Calendar II and III","Calendar II tolerates double but not triple booking — track single-booked and overlap intervals separately, checking candidates against the overlap list. Calendar III asks the maximum overlap ever: a sorted map of plus-one and minus-one deltas, prefix-summed per query.","Intervals & Sweep",
fact,Interview Prep,llm,"Design plus intervals hybrid","The calendar ladder is the interval cluster wearing a design-question costume: the interviewer watches structure CHOICE (sorted map versus list versus delta map) as requirements escalate. Practicing all three rungs in sequence builds exactly that muscle.","Intervals & Sweep",
quiz,Interview Prep,llm,"Quiz: Calendar III engine","MyCalendarThree must report the maximum booking overlap after each new event. Which structure powers the standard solution?","Intervals & Sweep","{""options"": [""A max-heap of events"", ""A sorted map of +1 start and -1 end deltas, prefix-summed"", ""A trie of times"", ""A union-find over hours""], ""correct"": ""A sorted map of +1 start and -1 end deltas, prefix-summed"", ""explain"": ""Each booking adds a delta pair; sweeping the sorted map's running sum reproduces concurrency over time, and its maximum is the answer — the sweep line living inside a data structure.""}"
fact,Interview Prep,llm,"One language, mastered","Interviewers care less about WHICH language than how fluently you drive it. Pick one and drill until sorting with a custom key, hash map iteration, string building, and heap usage flow without pauses — syntax fumbling reads as inexperience even when thinking is sound.","Languages & OOP",
fact,Interview Prep,llm,"Standard library fluency","Know your language's interview toolkit cold: in Python — collections.deque, Counter, defaultdict, heapq, bisect, sorted with key. In Java — ArrayDeque, PriorityQueue with comparators, TreeMap, StringBuilder, Arrays.sort. Reaching for the right tool instantly buys minutes of thinking time.","Languages & OOP",
fact,Interview Prep,llm,"Idioms signal experience","Idiomatic code is a hiring signal: Python enumerate instead of range-len, tuple unpacking for swaps, comprehensions where they clarify. Fighting the language with foreign idioms suggests you have not lived in it — practice in the dialect natives write.","Languages & OOP",
quiz,Interview Prep,llm,"Quiz: Language choice","What matters most about your interview language choice?","Languages & OOP","{""options"": [""Choosing the fastest-executing language"", ""Deep fluency in whichever language you pick"", ""Choosing the interviewer's favorite"", ""Using the newest language""], ""correct"": ""Deep fluency in whichever language you pick"", ""explain"": ""Interviewers evaluate problem solving through the medium of code — hesitant syntax obscures good thinking. Any mainstream language is acceptable; mastery of it is not optional.""}"
fact,Interview Prep,llm,"What Java and Python really pass","Java is strictly pass-by-value — but the value of an object variable IS a reference, so methods can mutate the object yet cannot rebind the caller's variable. Python's model is the same idea: call-by-object-reference. Reassignment inside a function never affects the caller.","Languages & OOP",
fact,Interview Prep,llm,"Mutation vs rebinding","The distinction that resolves every confusion: list.append inside a function is MUTATION — visible to the caller; list = [] inside is REBINDING — invisible. Interview bugs from aliasing (two variables, one underlying list) trace to exactly this line.","Languages & OOP",
fact,Interview Prep,llm,"Mutable default arguments","Python's famous trap: def f(x, acc=[]) evaluates the default ONCE, so every call shares one list that accumulates garbage across calls. The idiom is acc=None, then acc = [] inside. Naming this unprompted when writing recursive helpers is a strong fluency tell.","Languages & OOP",
quiz,Interview Prep,llm,"Quiz: Rebinding visibility","A Python function receives a list and executes lst = [1, 2, 3]. What does the caller observe?","Languages & OOP","{""options"": [""The caller's list becomes [1, 2, 3]"", ""Nothing — rebinding a parameter never affects the caller"", ""A runtime error"", ""The list is deep-copied""], ""correct"": ""Nothing — rebinding a parameter never affects the caller"", ""explain"": ""Assignment points the LOCAL name at a new object; the caller's reference still targets the original. Mutation like lst.append WOULD be visible — the mutation-versus-rebinding line.""}"
fact,Interview Prep,llm,"The four pillars","Encapsulation hides internal state behind an interface; abstraction exposes essential behavior while hiding mechanism; inheritance lets types extend types; polymorphism lets one call site dispatch to many implementations. Have a one-sentence definition AND a concrete example for each.","Languages & OOP",
fact,Interview Prep,llm,"Polymorphism in practice","Polymorphism is why code can call shape.area() without knowing the shape: each subclass supplies its own implementation and dynamic dispatch picks at runtime. It is the pillar interviews probe deepest — be ready to contrast overriding (runtime) with overloading (compile-time).","Languages & OOP",
fact,Interview Prep,llm,"Encapsulation's real payoff","Encapsulation is not secrecy for its own sake — it is invariant protection: a BankAccount whose balance changes only through deposit and withdraw can enforce non-negativity in one place. Framing pillars by the bugs they prevent beats reciting textbook definitions.","Languages & OOP",
quiz,Interview Prep,llm,"Quiz: Which pillar","Code calls animal.speak() and a Dog barks while a Cat meows through the same call site. Which OOP pillar is this?","Languages & OOP","{""options"": [""Encapsulation"", ""Polymorphism"", ""Abstraction"", ""Composition""], ""correct"": ""Polymorphism"", ""explain"": ""One interface, many behaviors, selected by the object's runtime type — the definition of polymorphism via method overriding and dynamic dispatch.""}"
fact,Interview Prep,llm,"Interface vs abstract class","An interface declares a capability contract with no state — a class can implement many. An abstract class shares partial implementation and fields — single inheritance in Java. Rule of thumb: interfaces for CAN-DO capabilities, abstract classes for IS-A families with shared code.","Languages & OOP",
fact,Interview Prep,llm,"Composition over inheritance","Prefer building behavior by CONTAINING collaborators over inheriting: composition swaps behavior at runtime, avoids fragile base class coupling, and dodges hierarchy explosions. The classic illustration: a Stack IMPLEMENTED-WITH a list, not extending one — extending exposes insert-anywhere and breaks the stack contract.","Languages & OOP",
fact,Interview Prep,llm,"When inheritance is right","Inheritance still earns its place for genuine is-a relationships with stable base behavior — template method patterns, framework extension points. The interview answer is not never inherit but default to composition; justify inheritance. Nuance beats slogans.","Languages & OOP",
